{
  "season": 2026,
  "week": 1,
  "updated_utc": "2026-09-14T21:46:51Z",
  "parlays": [
    {
      "parlay_id": "401872931-g1",
      "scope": "game",
      "legs": [
        {
          "market": "moneyline",
          "selection": "DEN ML",
          "implied_prob": 0.4573,
          "model_prob": 0.5938
        },
        {
          "market": "spread",
          "selection": "DEN +2.5",
          "implied_prob": 0.5043,
          "model_prob": 0.5,
          "edge_note": "NO EDGE \u2014 cover model measured below coin-flip (log-loss 0.7231 vs 0.6931, 797 games 2023-25); priced flat until a margin model clears never-regress"
        }
      ],
      "model_ev": 1.0416,
      "confidence_tier": "high",
      "correlation_note": "Same-game legs are correlated; combined probability uses a pairwise correlation adjustment (not the independence product). Book prices legs independently, so the edge lives in that gap.",
      "game_id": "401872931"
    },
    {
      "parlay_id": "401872931-g2",
      "scope": "game",
      "legs": [
        {
          "market": "qb_pass_yds",
          "selection": "P. Mahomes 225+ pass yds",
          "implied_prob": 0.4323,
          "model_prob": 0.4137,
          "pricing": "calibrated",
          "estimate": true,
          "mu": 215.59,
          "sd": 76.66,
          "z": -0.1163,
          "line": 224.5
        },
        {
          "market": "wr_rec_yds",
          "selection": "R. Rice 60+ rec yds",
          "implied_prob": 0.4142,
          "model_prob": 0.3964,
          "pricing": "calibrated",
          "estimate": true,
          "mu": 52.95,
          "sd": 41.58,
          "z": -0.1574,
          "line": 59.5
        }
      ],
      "model_ev": 0.3391,
      "confidence_tier": "medium",
      "correlation_note": "Same-game legs are correlated; combined probability uses a pairwise correlation adjustment (not the independence product). Book prices legs independently, so the edge lives in that gap.",
      "game_id": "401872931"
    },
    {
      "parlay_id": "401872931-g3",
      "scope": "game",
      "legs": [
        {
          "market": "moneyline",
          "selection": "DEN ML",
          "implied_prob": 0.4573,
          "model_prob": 0.5938
        },
        {
          "market": "rb_rush_yds",
          "selection": "R. Harvey 60+ rush yds",
          "implied_prob": 0.2668,
          "model_prob": 0.2553,
          "pricing": "calibrated",
          "estimate": true,
          "mu": 27.37,
          "sd": 38.87,
          "z": -0.8267,
          "line": 59.5
        }
      ],
      "model_ev": 0.732,
      "confidence_tier": "medium",
      "correlation_note": "Same-game legs are correlated; combined probability uses a pairwise correlation adjustment (not the independence product). Book prices legs independently, so the edge lives in that gap.",
      "game_id": "401872931"
    },
    {
      "parlay_id": "401872656-g1",
      "scope": "game",
      "legs": [
        {
          "market": "moneyline",
          "selection": "SEA ML",
          "implied_prob": 0.6669,
          "model_prob": 0.6382
        },
        {
          "market": "rb_rush_yds",
          "selection": "T. Henderson 60+ rush yds",
          "implied_prob": 0.2393,
          "model_prob": 0.229,
          "pricing": "calibrated",
          "estimate": true,
          "mu": 30.48,
          "sd": 38.87,
          "z": -0.7465,
          "line": 59.5
        }
      ],
      "model_ev": -0.4371,
      "confidence_tier": "low",
      "correlation_note": "Same-game legs are correlated; combined probability uses a pairwise correlation adjustment (not the independence product). Book prices legs independently, so the edge lives in that gap.",
      "game_id": "401872656"
    },
    {
      "parlay_id": "401872656-g2",
      "scope": "game",
      "legs": [
        {
          "market": "moneyline",
          "selection": "SEA ML",
          "implied_prob": 0.6669,
          "model_prob": 0.6382
        },
        {
          "market": "wr_rec_yds",
          "selection": "J. Smith-Njigba 60+ rec yds",
          "implied_prob": 0.6856,
          "model_prob": 0.6561,
          "pricing": "calibrated",
          "estimate": true,
          "mu": 94.02,
          "sd": 41.58,
          "z": 0.83,
          "line": 59.5
        }
      ],
      "model_ev": -0.0343,
      "confidence_tier": "low",
      "correlation_note": "Same-game legs are correlated; combined probability uses a pairwise correlation adjustment (not the independence product). Book prices legs independently, so the edge lives in that gap.",
      "game_id": "401872656"
    },
    {
      "parlay_id": "401872656-g3",
      "scope": "game",
      "legs": [
        {
          "market": "rb_rush_yds",
          "selection": "T. Henderson 60+ rush yds",
          "implied_prob": 0.2393,
          "model_prob": 0.229,
          "pricing": "calibrated",
          "estimate": true,
          "mu": 30.48,
          "sd": 38.87,
          "z": -0.7465,
          "line": 59.5
        },
        {
          "market": "wr_rec_yds",
          "selection": "J. Smith-Njigba 60+ rec yds",
          "implied_prob": 0.6856,
          "model_prob": 0.6561,
          "pricing": "calibrated",
          "estimate": true,
          "mu": 94.02,
          "sd": 41.58,
          "z": 0.83,
          "line": 59.5
        }
      ],
      "model_ev": -0.2059,
      "confidence_tier": "low",
      "correlation_note": "Same-game legs are correlated; combined probability uses a pairwise correlation adjustment (not the independence product). Book prices legs independently, so the edge lives in that gap.",
      "game_id": "401872656"
    },
    {
      "parlay_id": "401872657-g1",
      "scope": "game",
      "legs": [
        {
          "market": "moneyline",
          "selection": "SF ML",
          "implied_prob": 0.5364,
          "model_prob": 0.5133
        },
        {
          "market": "rb_rush_yds",
          "selection": "K. Williams 60+ rush yds",
          "implied_prob": 0.5449,
          "model_prob": 0.5214,
          "pricing": "calibrated",
          "estimate": true,
          "mu": 71.08,
          "sd": 38.87,
          "z": 0.298,
          "line": 59.5
        }
      ],
      "model_ev": -0.3226,
      "confidence_tier": "low",
      "correlation_note": "Same-game legs are correlated; combined probability uses a pairwise correlation adjustment (not the independence product). Book prices legs independently, so the edge lives in that gap.",
      "game_id": "401872657"
    },
    {
      "parlay_id": "401872657-g2",
      "scope": "game",
      "legs": [
        {
          "market": "moneyline",
          "selection": "SF ML",
          "implied_prob": 0.5364,
          "model_prob": 0.5133
        },
        {
          "market": "qb_pass_yds",
          "selection": "B. Purdy 225+ pass yds",
          "implied_prob": 0.3281,
          "model_prob": 0.314,
          "pricing": "calibrated",
          "estimate": true,
          "mu": 179.94,
          "sd": 76.66,
          "z": -0.5812,
          "line": 224.5
        }
      ],
      "model_ev": 0.0476,
      "confidence_tier": "low",
      "correlation_note": "Same-game legs are correlated; combined probability uses a pairwise correlation adjustment (not the independence product). Book prices legs independently, so the edge lives in that gap.",
      "game_id": "401872657"
    },
    {
      "parlay_id": "401872657-g3",
      "scope": "game",
      "legs": [
        {
          "market": "rb_rush_yds",
          "selection": "K. Williams 60+ rush yds",
          "implied_prob": 0.5449,
          "model_prob": 0.5214,
          "pricing": "calibrated",
          "estimate": true,
          "mu": 71.08,
          "sd": 38.87,
          "z": 0.298,
          "line": 59.5
        },
        {
          "market": "wr_rec_yds",
          "selection": "P. Nacua 60+ rec yds",
          "implied_prob": 0.6919,
          "model_prob": 0.6621,
          "pricing": "calibrated",
          "estimate": true,
          "mu": 98.92,
          "sd": 41.58,
          "z": 0.948,
          "line": 59.5
        }
      ],
      "model_ev": -0.0217,
      "confidence_tier": "low",
      "correlation_note": "Same-game legs are correlated; combined probability uses a pairwise correlation adjustment (not the independence product). Book prices legs independently, so the edge lives in that gap.",
      "game_id": "401872657"
    },
    {
      "parlay_id": "401872925-g1",
      "scope": "game",
      "legs": [
        {
          "market": "moneyline",
          "selection": "CIN ML",
          "implied_prob": 0.6327,
          "model_prob": 0.6055
        },
        {
          "market": "rb_rush_yds",
          "selection": "C. Brown 60+ rush yds",
          "implied_prob": 0.4694,
          "model_prob": 0.4492,
          "pricing": "calibrated",
          "estimate": true,
          "mu": 56.94,
          "sd": 38.87,
          "z": -0.0659,
          "line": 59.5
        }
      ],
      "model_ev": 0.1441,
      "confidence_tier": "medium",
      "correlation_note": "Same-game legs are correlated; combined probability uses a pairwise correlation adjustment (not the independence product). Book prices legs independently, so the edge lives in that gap.",
      "game_id": "401872925"
    },
    {
      "parlay_id": "401872925-g2",
      "scope": "game",
      "legs": [
        {
          "market": "rb_rush_yds",
          "selection": "C. Brown 60+ rush yds",
          "implied_prob": 0.4694,
          "model_prob": 0.4492,
          "pricing": "calibrated",
          "estimate": true,
          "mu": 56.94,
          "sd": 38.87,
          "z": -0.0659,
          "line": 59.5
        },
        {
          "market": "wr_rec_yds",
          "selection": "J. Chase 60+ rec yds",
          "implied_prob": 0.6685,
          "model_prob": 0.6397,
          "pricing": "calibrated",